{
  "kind": "diamond.manifest.v0",
  "diamond_id": "diamond:abc123",
  "diamond_candidate_id": "diamond-candidate:abc123",
  "diamond_kind": "D.PROJ",
  "title": "Sealed Diamond",
  "purpose": "Valid sealed diamond",
  "projection_hash": "proj:abc123",
  "source_boundary_hash": "boundary:abc123",
  "sealability_report_hash": "sealability:abc123",
  "sealability_context": {
    "rights": {"attached": true},
    "revocation": {"exists": true, "method": "supersede"}
  },
  "artifacts": [],
  "manifest_hash": "diamond-manifest:abc123",
  "state": "current",
  "created_at": "2026-07-02T12:00:00Z",
  "created_by": "op:test"
}
